<xsd:schema xmlns:xsd="http://www.w3.org/2001/XMLSchema"
            targetNamespace="urn:books"
            xmlns:bks="urn:books">
  <xsd:element name="books" type="bks:BooksForm"/>
  <xsd:complexType name="BooksForm">
    <xsd:sequence>
      <xsd:element name="book" 
                   type="bks:BookForm" 
                   minOccurs="0" 
                   maxOccurs="unbounded"/>
    </xsd:sequence>
  </xsd:complexType>
  <xsd:complexType name="BookForm">
    <xsd:sequence>
      <xsd:element name="author" type="xsd:string"/>
      <xsd:element name="title" type="xsd:string"/>
      <xsd:element name="genre" type="xsd:string"/>
      <xsd:element name="price" type="xsd:float" minOccurs="0"/>
      <xsd:element name="pub_date" type="xsd:date" minOccurs="0"/>
      <xsd:element name="review" type="xsd:string"/>
    </xsd:sequence>
    <xsd:attribute name="id" type="xsd:string"/>
  </xsd:complexType>
</xsd:schema>