<?xml version="1.0"?>
<!--x:books xmlns:x="urn:books" xmlns:xsi="http://www.w3.org/2001/XMLSchema-instance" xsi:schemaLocation="urn:books books.xsd"-->
<x:books xmlns:x="urn:books">
  <book id="bk001">
    <author>Hightower, Kim</author>
    <title>The First Book</title>
    <genre>Fiction</genre>
    <price>44.95</price>
    <pub_date>2000-10-01</pub_date>
    <review>An amazing story of nothing.</review>
  </book>
  <book id="bk003">
    <author>Nagata, Suanne</author>
    <title>Becoming Somebody</title>
    <genre>Biography</genre>
    <review>A masterpiece of the fine art of gossiping.</review>
  </book>
  <book id="bk002">
    <author>Oberg, Bruce</author>
    <title>The Poet's First Poem</title>
    <genre>Poem</genre>
    <price>24.95</price>
    <review>The least poetic poems of the decade.</review>
  </book>
</x:books>
